Item Code,Item,Description,HS Code,HS07 Code,HS12 Code,CPC Code
1735,Vegetables Primary,"Vegetables, as classified in this group, are mainly annual plants cultivated as field and garden crops in the open and under glass, and used almost exclusively for food. Vegetables grown principally for animal feed or seed should be excluded. Certain plants, normally classified as cereals and pulses, belong to this group when harvested green, such as green maize, green peas, etc. This grouping differs from international trade classifications for vegetables in that it includes melons and watermelons, which are normally considered to be fruit crops. But, whereas fruit crops are virtually all permanent crops, melons and watermelons are similar to vegetables in that they are temporary crops. Chillies and green peppers are included in this grouping when they are harvested for consumption as vegetables and not processed into spices. FAO production data for green peas and green beans refer to the total weight including pods, although some countries report on a shelled weight basis. The weight of the pods ranges from 40 to 50 percent for peas to up to 70 percent for broad beans. Area data on small vegetable gardens are often omitted in agricultural surveys, although production estimates may be reported. Trade data for fresh vegetables also include chilled vegetables, meaning the temperature of the products has been reduced to around 0øC without the products being frozen. Vegetables contain principally water, accounting for between 70 percent and 95 percent of their weight. They are low in nutrients, but contain minerals and vitamins. FAO covers 27 primary vegetable products. Each is listed along with its code, botanical name, or names, and a short description. PRODUCTS DERIVED FROM VEGETABLES refer to processed products. Apart from a few main products, international trade classifications do not permit a sufficiently detailed classification of processed products according to the primary commodity used in the preparation. A similar situation prevails for frozen vegetables.",,,,
463,"Vegetables, fresh nes","Including inter alia: bamboo shoots (Bambusa spp.); beets, chards (Beta vulgaris); capers (Capparis spinosa); cardoons (Cynara cardunculus); celery (Apium graveolens); chervil (Anthriscus cerefolium); cress (Lepidium sativum); fennel (Foeniculum vulgare); horseradish (Cochlearia armoracia); marjoram, sweet (Majorana hortensis); oyster plant (Tragopogon porrifolius); parsley (Petroselinum crispum); parsnips (Pastinaca sativa); radish (Raphanus sativus); rhubarb (Rheum spp.); rutabagas, swedes (Brassica napus); savory (Satureja hortensis); scorzonera (Scorzonera hispanica); sorrel (Rumex acetosa); soybean sprouts tarragon (Artemisia dracunculus); watercress (Nasturtium officinale). Other vegetables that are not identified separately because of their minor relevance at the international level. Because of their limited local importance, some countries report vegetables under this heading that are classified individually by FAO.",,"070690, 070940, 070990","070690, 070940, 070999",1290.9
420,"Vegetables, leguminous nes",Vicia faba. For shelling.,,70890,70890,1243
205,Vetches,Spring/common vetch (Vicia sativa). Used mainly for animal feed.,,121490,121490,1709.01
222,"Walnuts, with shell","Jugland spp.: J. regia. Produced in temperate zones of the Northern Hemisphere, particularly in the United States.",,80231,80231,1376
567,Watermelons,Citrullus vulgaris.,,80711,80711,1221
15,Wheat,"Triticum spp.: common (T. aestivum) durum (T. durum) spelt (T. spelta). Common and durum wheat are the main types. Among common wheat, the main varieties are spring and winter, hard and soft, and red and white. At the national level, different varieties should be reported separately, reflecting their different uses. Used mainly for human food.",,"100110, 100190","100111, 100119, 100191, 100199",111
137,Yams,"Dioscorea spp.. The principal edible yams are widely grown throughout the tropics. A starchy staple foodstuff, normally eaten as a vegetable, boiled, baked or fried. In West Africa they are consumed mainly as ""fufu"", a stiff glutinous dough. Trade data cover both fresh and dried yams.",,71490,71430,1540
135,Yautia (cocoyam),"Xanthosoma spp.; malanga, new cocoyam, ocumo, tannia (X. sagittifolium). Several plants are included in this group, some with edible tubers and others with edible stems (also called aroids). Yautia is grown mainly in the Caribbean and is used for food. Trade data cover both fresh and dried yautia.",,71490,71450,1591