Item Code,Item,Description,HS Code,HS07 Code,HS12 Code,CPC Code
234,Nuts nes,"Including inter alia: pecan nut (Carya illinoensis); butter or swarri nut (Caryocar nuciferum); pili nut, Java almond, Chinese olives (Canarium spp.); paradise or sapucaia nut (Lecythis zabucajo); Queensland, macadamia nut (Macadamia ternifolia); pignolia nut (Pinus pinea). Other nuts that are not identified separately because of their minor relevance at the international level. Because of their limited local importance, some countries report nuts under this heading that are classified individually by FAO.",,"080260, 080290","080261, 080262, 080290",1379.9
75,Oats,"Avena spp., mainly Avena sativa. A plant with open, spreading panicle-bearing large spikelets. Used primarily in breakfast foods. Makes excellent fodder for horses.",,100400,"100410, 100490",117
254,Oil palm fruit,"Elaeis guineensis. The oil palm produces bunches containing a large number of fruits with the fleshy mesocarp enclosing a kernel that is covered by a very hard shell. FAO considers palm oil (coming from the pulp) and palm kernels to be primary products. The oil extraction rate from a bunch varies from 17 to 27% for palm oil, and from 4 to 10% for palm kernels.",,120799,120710,1491.01
1731,Oilcrops,"Oil-Bearing Crops or Oil Crops include both annual (usually called oilseeds) and perennial plants whose seeds, fruits or mesocarp and nuts are valued mainly for the edible or industrial oils that are extracted from them. Dessert and table nuts, although rich in oil, are listed under Nuts (see Chapter .). Annual oilseed plants tha are either harvested green or are used for grazing and for green manure are included with Fodder Crops (see Chapter 11.). Some of the crops included in this chapter are also fibre crops in that both the seeds and the fibres are harvested from the same plant. Such crops include: coconuts, yielding coir from the mesocarp; kapok fruit; seed cotton; linseed; and hempseed. In the case of several other crops, both the pulp of the fruit and the kernels are used for oil. The main crops of this type are oil-palm fruit and tallow tree seeds. Production data are reported in terms of dry products as marketed. Exceptions to this general rule include: groundnuts, which are reported as groundnuts in the shell; coconuts, which are reported on the basis of the weight of the nut including the woody shell, but excluding the fibrous outer husk; and palm oil, which is reported in terms of oil, by weight. Because of the very different nature of the various oil crops, the primary products cannot be aggregated in their natural weight to obtain total oil crops. For this reason, FAO converts the crops to either an oil equivalent or an oilcake equivalent before aggregating them. Only 5-6 percent of the world production of oil crops is used for seed (oilseeds) and animal feed, while about 8 percent is used for food. The remaining 86 percent is processed into oil. The fat content of oil crops varies widely. Fat content ranges from as low as 10-15 percent of the weight of coconuts to over 50 percent of the weight of sesame seeds and palm kernels. Carbohydrates, mainly polysaccharides, range from 15 to 30 percent in the oilseeds, but are generally lower in other oil-bearing crops. The protein content is very high in soybeans, at up to 40 percent, but is much lower in many other oilseeds, at 15-25 percent, and is lower still in some other oil-bearing crops.",,,,
1841,"Oilcrops, Cake Equivalent",,,,,
1732,"Oilcrops, Oil Equivalent","Oil-Bearing Crops or Oil Crops include both annual (usually called oilseeds) and perennial plants whose seeds, fruits or mesocarp and nuts are valued mainly for the edible or industrial oils that are extracted from them. Dessert and table nuts, although rich in oil, are listed under Nuts (see Chapter .). Annual oilseed plants tha are either harvested green or are used for grazing and for green manure are included with Fodder Crops (see Chapter 11.). Some of the crops included in this chapter are also fibre crops in that both the seeds and the fibres are harvested from the same plant. Such crops include: coconuts, yielding coir from the mesocarp; kapok fruit; seed cotton; linseed; and hempseed. In the case of several other crops, both the pulp of the fruit and the kernels are used for oil. The main crops of this type are oil-palm fruit and tallow tree seeds. Production data are reported in terms of dry products as marketed. Exceptions to this general rule include: groundnuts, which are reported as groundnuts in the shell; coconuts, which are reported on the basis of the weight of the nut including the woody shell, but excluding the fibrous outer husk; and palm oil, which is reported in terms of oil, by weight. Because of the very different nature of the various oil crops, the primary products cannot be aggregated in their natural weight to obtain total oil crops. For this reason, FAO converts the crops to either an oil equivalent or an oilcake equivalent before aggregating them. Only 5-6 percent of the world production of oil crops is used for seed (oilseeds) and animal feed, while about 8 percent is used for food. The remaining 86 percent is processed into oil. The fat content of oil crops varies widely. Fat content ranges from as low as 10-15 percent of the weight of coconuts to over 50 percent of the weight of sesame seeds and palm kernels. Carbohydrates, mainly polysaccharides, range from 15 to 30 percent in the oilseeds, but are generally lower in other oil-bearing crops. The protein content is very high in soybeans, at up to 40 percent, but is much lower in many other oilseeds, at 15-25 percent, and is lower still in some other oil-bearing crops.",,,,
339,Oilseeds nes,"Includes inter alia: beech nut (Fagus sylvatica);(Aleurites moluccana);(Carapa guineensis);(Croton tiglium);(Bassia latifolia);(Guizotia abyssinica);(Licania rigida);(Perilla frutescens);(Jatropha curcas);(Shorea robusta);(Pongamia glabra);(Astrocaryum spp.). Other oilseeds, oleaginous fruits and nuts that are not identified separately because of their minor relevance at the international level. Because of their limited local importance, some countries report commodities under this heading that are classified individually by FAO. Also included under this code are tea seeds, grape pips and tomato seeds from which oil is extracted.",,120799,120799,1449.9
430,Okra,Abelmoschus esculentus; Hibiscus esculentus. Also called gombo.,,70990,70999,1239.01
260,Olives,Olea europaea. Includes table olives and olives for oil.,,70990,70992,1450
403,"Onions, dry","Allium cepa. Includes onions at a mature stage, but not dehydrated onions.",,70310,70310,1253.02
402,"Onions, shallots, green",Shallots (Allium ascalonicum); onions (A. cepa); welsh onions (A. fistulosum). Young onions pulled before the bulb has enlarged; used especially in salads. Includes onion sets.,,70310,70310,1253.01
490,Oranges,"Common, sweet orange (Citrus sinensis); bitter orange (C. aurantium). Bitter oranges are used primarily in the preparation of marmalade.",,80510,80510,1323
600,Papayas,Carica papaya.,,80720,80720,1317
534,Peaches and nectarines,Prunus persica; Amygdalus persica; Persica laevis.,,80930,80930,1345
521,Pears,Pyrus communis.,,80820,80830,1342.01
187,"Peas, dry",Garden pea (Pisum sativum); field pea (P. arvense).,,71310,71310,1705
417,"Peas, green","Pisum sativum. Mostly for shelling, but including edible- podded peas or sugar peas.",,70810,70810,1242
687,Pepper (piper spp.),"Black, white pepper (Piper nigrum); long pepper (P. longum). Perennial climbing vines. Includes whole, crushed or ground berries. Black pepper is produced from partially ripe berries, while white pepper is from fully ripe berries which have had the outer hull removed.",,"090411, 090412","090411, 090412",1651
748,Peppermint,"Mentha spp.: M. piperita. Leaves and flowers are used in the perfumery, food and other industries.",,121190,121190,1930.01
587,Persimmons,Diospyros kaki: D. virginiana.,,81090,81070,1359.01
197,Pigeon peas,"Pigeon pea, cajan pea, Congo bean (Cajanus cajan).",,71390,71360,1707
574,Pineapples,Ananas comosus; A. sativ. Trade figures may include dried pineapples.,,80430,80430,1318
223,Pistachios,Pistacia vera. Produced mainly in the Near East and the United States.,,80250,"080251, 080252",1375
489,Plantains and others,Musa paradisiaca. Generally known as a cooking banana. Data should be reported excluding the weight of the central stalk.,,80300,80310,1313
536,Plums and sloes,"Greengage, mirabelle, damson (Prunus domestica); sloe (P. spinosa).",,80940,80940,1346
296,Poppy seed,"Papaver somniferum. The source of opium, poppy seeds are also used in baking and confectionery.",,120791,120791,1448
116,Potatoes,"Solanum tuberosum Irish potato. A seasonal crop grown in temperate zones all over the world, but primarily in the northern hemisphere.",,"070110, 070190","070110, 070190",1510
211,Pulses nes,"Including inter alia: lablab or hyacinth bean (Dolichos spp.); jack or sword bean (Canavalia spp.); winged bean (Psophocarpus tetragonolobus); guar bean (Cyamopsis tetragonoloba); velvet bean (Stizolobium spp.); yam bean (Pachyrrhizus erosus);. Vigna spp. other than those included in 176 and 195 Other pulses that are not identified separately because of their minor relevance at the international level. Because of their limited local importance, some countries report pulses under this heading that are classified individually by FAO.",,71390,71390,1709.9
1726,"Pulses, Total","Pulses are annual leguminous crops yielding from one to 12 grains or seeds of variable size, shape and color within a pod. They are used for both food and feed. The term ""pulses"" is limited to crops harvested solely for dry grain, thereby excluding crops harvested green for food (green peas, green beans, etc.) which are classified as vegetable crops. Also excluded are those crops used mainly for oil extraction (e.g. soybean and groundnuts) and leguminous crops (e.g. seeds of clover and alfalfa) that are used exclusively for sowing purposes. In addition to their food value, pulses also play an important role in cropping systems because of their ability to produce nitrogen and thereby enrich the soil. Pulses contain carbohydrates, mainly starches (55-65 percent of the total weight); proteins, including essential amino acids (18-25 percent, and much higher than cereals); and fat (1 - 4 percent). The remainder consists of water and inedible substances. Production data should be reported in terms of dry clean weight, excluding the weightof the pods. Certain kinds of pulses can be skinned and partially crushed or split toremove the seed-coat, but the resulting products are still considered raw for classification purposes. FAO covers 11 primary pulses. Each is listed below, along with its code, its botanical name, or names, and a short description. Only two processed products are included in the FAO list, namely flour of pulses and bran of pulses.",,,,
394,"Pumpkins, squash and gourds",Cucurbita spp. Includes marrows.,,70990,70993,1235
754,"Pyrethrum, dried","Chrysanthemum cinerariifolium. Includes leaves, stems and flowers. For insecticides, fungicides and similar products.",,121190,121190,1930.02
523,Quinces,Cydonia oblonga; C. vulgaris; C. japonica.,,80820,80840,1342.02
92,Quinoa,"Chenopodium quinoa (Chenopodiaceae). A minor cereal, which tolerates high altitudes, quinoa is cultivated primarily in andean countries. Used for food and to make chicha, a fermented beverage.",,100890,100850,1194
788,Ramie,"China grass, white ramie (Boehmeria nivea); rhea, green ramie (B. tenacissima). Ramie fibre is obtained from the bast of the plant. For trade coverage see 780.",,530500,530500,1929.04
270,Rapeseed,"Brassica napus var. oleifera. Valued mainly for its oil. Older varieties are rich in Erucic acid, which is considered unhealthy.",,"120510, 120590","120510, 120590",1443
547,Raspberries,"Ubus idaeus. Trade data may include blackberries, mulberries and loganberries (a cross between the raspberry and blackberry).",,81020,81020,1353.01
27,"Rice, paddy","Oryza spp., mainly oryza sativa. Rice grain after threshing and winnowing. Also known as rice in the husk and rough rice. Used mainly for human food.",,100610,100610,113
30,"Rice, paddy (rice milled equivalent)",,,,,
149,Roots and tubers nes,"Including inter alia: arracacha (Arracacoa xanthorrhiza); arrowroot (Maranta arundinacea); chufa (Cyperus esculentus); sago palm (Metroxylon spp.); oca and ullucu (Oxalis tuberosa and Ullucus tuberosus); yam bean, jicama (Pachyrxhizus erosus, P. angulatus); mashua (Tropaeolum tuberosum); Jerusalem artichoke, topinambur (Helianthus tuberosus). Other tubers, roots or rhizomes, fresh, that are not identified separately because of their minor relevance at the international level. Because of their limited local importance, some countries report roots and tubers under this commodity heading that are classified individually by FAO.",,71490,71490,1599.1
1720,"Roots and Tubers, Total","Roots and Tubers are plants yielding starchy roots, tubers, rhizomes, corms and stems. They are used mainly for human food (as such or in processed form), for animal feed and for manufacturing starch, alcohol and fermented beverages including beer. The denomination ""roots and tubers"" excludes crops which are cultivated mainly for feed (mangolds, swedes) or for processing into sugar (sugar beets), and those classified as ""roots, bulb and tuberous vegetables"" (onions, garlic and beets). It does include starch and the starchy pith and flour obtained from the trunk of the sago palm and the stem of the Abyssinian banana (Musa ensete). Certain root crops, notably bitter cassava, contain toxic substances, particularly in the skins. As a result, certain processes must be undertaken to make the product safe for human consumption. Apart from their high water content (70-80 percent), these crops contain mainly carbohydrates (largely starches that account for 16-24 percent of their total weight) with very little protein and fat (0-2 percent each). Methods of propagating root crops vary. A live potato tuber or seed must be planted but only part of the live yam tuber and a piece of the stalk (not the root) in the case of cassava. Production data of root crops should be reported in terms of clean weight, i.e. free of earth and mud. FAO distinguishes among seven primary root and tuber crops. The code and name of each one appears in the list that follows, along with its botanical name, or names, and a short description. The processed products of roots and tubers are listed together with their parent primary crops.",,,,
836,"Rubber, natural","Hevea brasiliensis Latex. The liquid secreted by the rubber tree. Includes stabilized or concentrated latex and prevulcanized rubber latex. In trade figures, liquid weight is converted to dry weight at 60%.",,400110,400110,1950.01
71,Rye,"Secale cereale. A grain that is tolerant of poor soils, high latitudes and altitudes. Mainly used in making bread, whisky and beer. When fed to livestock, it is generally mixed with other grains.",,100200,"100210, 100290",116
280,Safflower seed,Carthamus tinctorius. Valued mainly for its oil. Minor uses include as a human food and as poultry feed.,,120799,120760,1446
328,Seed cotton,"Gossypium spp.: Unginned cotton. Grown for both seed and for fibre. FAO considers cottonseed, cotton lint and linters to be primary products. Lint content ranges from 30 to 40%, seed 55 to 65%, and linters 2 to 5% though they are not always separated.",,520100,520100,1921.01
289,Sesame seed,"Sesamum indicum. Valued for its oil, but also as a food, either raw or roasted, as well as in bakery products and other food preparations.",,120740,120740,1444
789,Sisal,"Agave sisalana. Sisal fibre is obtained from the leaves of the plant. It also is used as an ornamental plant. Trade data cover fibres that are raw, prepared for spinning, and tow and waste, including yarn waste and garnetted stock.",,530500,530500,1929.05
83,Sorghum,"Sorghum spp.: guinea corn (S. guineense); common, milo, feterita, kaffir corn (S. vulgare); durra, jowar, kaoliang (S. dura). A cereal that has both food and feed uses. Sorghum is a major food grain in most of Africa, where it is also used in traditional beer brewing. It is desirable to report hybrid and other varieties separately.",,100700,"100710, 100790",114
236,Soybeans,"Glycine soja. The most important oil crop. Also widely consumed as a bean and in the form of various derived products because of its high protein content, e.g. soya milk, meat, etc.",,120100,"120110, 120190",141
723,Spices nes,"Including inter alia: bay leaves (Laurus nobilis); dill seed (Anethum graveolens); fenugreek seed (Trigonella foenum-graecum); saffron (Crocus sativus); thyme (Thymus vulgaris); turmeric (Curcuma longa). Other spices that are not identified separately because of their minor relevance at the international level. Because of their limited local importance, some countries report spices under this heading that are classified individually by FAO. This heading also includes curry powder and other mixtures of different spices.",,"091020, 091030, 091091, 091099","091020, 091030, 091091, 091099",1699
373,Spinach,Spinacia oleracea. Trade figures may include New Zealand spinach (Tetragonia espansa) and orache (garden) spinach (Atriplex hortensis).,,70970,70970,1215
544,Strawberries,Fragaria spp..,,81010,81010,1354
423,String beans,Phaseolus vulgaris; Vigna spp. Not for shelling.,,70820,70820,1241.01
157,Sugar beet,"Beta vulgaris var. altissima. In some producing countries, marginal quantities are consumed, either directly as food or in the preparation of jams.",,121291,121291,1801
156,Sugar cane,"Saccharum officinarum. In some producing countries, marginal quantities of sugar cane are consumed, either directly as food or in the form of juice.",,121299,121293,1802
161,Sugar crops nes,"Including inter alia: sugar maple (Acer saccharum); sweet sorghum (Sorghum saccharatum); sugar palm (Arenga saccharifera). Includes minor sugar crops of local importance. In the case of saps, production is to be expressed in liquid equivalent.",,121299,121299,1809
1723,Sugar Crops Primary,"Sugar Crops and Sweeteners and derived products: In addition to providing the source for the manufacture of sugar, SUGAR CROPS are used to produce alcohol and ethanol. In certain countries, sugar cane is eaten raw in minor quantities. It also is used in the preparation of juices and for animal feed. There are two major sugar crops: sugar beets and sugar cane. However, sugar and syrups are also produced from the sap of certain species of maple trees, from sweet sorghum when cultivated explicitly for making syrup and from sugar palm. Sugar beets that are cultivated solely as a fodder crop and red or garden beets that are classified as vegetable crops are excluded from the FAO list of sugar crops. Sugar cane is a perennial grass (replanted at intervals using pieces of the cane stalks) that is cultivated mainly in the tropics. Sugar beet is an annual crop that is propagated by the seeds of the flowers. It is cultivated in cooler climates than sugar cane, mainly above the 35th parallel of the Northern Hemisphere. Both sugar beets and sugar cane have high water content, accounting for about 75 percent of the total weight of the plants. The sugar content of sugar cane ranges from 10 to 15 percent of the total weight, while that of sugar beets is between 13 and 18 percent. The protein and fat content of both beets and cane is almost nil. Production data on sugar beets and sugar cane relate to the harvested crop, free of soil, plant tops and leaves. FAO lists three primary sugar crops. Under the name SWEETENERS, FAO includes products used for sweetening that are derived from sugar crops, cereals, fruits or milk, or that are produced by insects. This category includes a wide variety of monosaccharide (glucose and fructose) and disaccharides (sucrose and saccharose). They exist either in a crystallized state as sugar, or in thick liquid form as syrups. The traditional sources of sugar are sugar cane and sugar beets. But in recent years, ever larger quantities of cereals (mainly maize) have been used to produce sweeteners derived from starch. OTHER DERIVED PRODUCTS. In addition to sugar, molasses is also obtained with various degrees of sugar content. The by-product obtained from the extraction of sugar is called bagasse in the case of sugar cane, and beet pulp in the case of sugar beets.",,,,
267,Sunflower seed,Helianthus annuus. Valued mainly for its oil. Minor uses include as a human food and as feed for birds.,,120600,120600,1445
122,Sweet potatoes,"Ipomoea batatas. A seasonal crop grown in tropical and subtropical regions. Used mainly for human food. Trade data cover fresh and dried tubers, whether or not sliced or in the form or pellets.",,71420,71420,1530
305,Tallowtree seed,Borneo tallow tree (Shorea aptera; S. stenocarpa); Chinese tallow tree (Sapium sebiferum; Stillingia sebifera). Grown wild and cultivated. FAO considers vegetable tallow and stillingia oil to be primary products (see below).,,120799,120799,1499.04
495,"Tangerines, mandarins, clementines, satsumas","Mandarin, tangerine (Citrus reticulata); clementine, satsuma (C. unshiu).",,80520,80520,1324
136,Taro (cocoyam),"Dasheen, eddoe, taro, old cocoyam(Colocasia esculenta). Aroids cultivated for their edible starchy corms or underground stems. Taro is grown throughout the tropics for food. Trade data cover both fresh and dried taro.",,71490,71440,1550
667,Tea,"Camellia sinensis; Thea sinensis; Thea assaamica. Includes green tea (unfermented), black tea (fermented), and partially fermented tea. Excludes green tea eaten as a vegetable.",,"090210, 090220, 090230, 090240","090210, 090220, 090230, 090240",1620
826,"Tobacco, unmanufactured","Nicotiana tabacum. Unmanufactured dry tobacco, including refuse that is not stemmed or stripped, or is partly or wholly stemmed or stripped.",,"240110, 240120, 240130","240110, 240120, 240130",1970
388,Tomatoes,Lycopersicon esculentum.,,70200,70200,1234
1729,"Treenuts, Total","Tree NUTS are dry fruits or kernels enclosed in woody shells or hard husks, which in turn are generally covered by a thick, fleshy/fibrous outer husk that is removed during harvest. Similar products, such as groundnuts, sunflower seeds and melon seeds, although often used for similar purposes, are included with oil-bearing crops.FAO includes in this group only dessert or table nuts. Nuts that are used mainly for flavouring beverages and masticatory and stimulant nuts should be excluded. An exception is made for areca nuts and kola nuts, which FAO considers to be inedible nuts, but which are included with the nut and derived products group to be consistent with international trade classifications. Nuts used mainly for the extraction of oil or butter, (e.g. sheanuts) as well as nuts contained in other fruits (e.g. peaches) are excluded. It should be noted that some countries report certain nut crops (chestnuts, pignolia nuts) with forestry products. Production data relate to the weight of nuts in the shell or husk, but without the outer husk. The weight of the kernel contained in the nut ranges from as low as 30 percent for cashew nuts to as high as 80 percent in the case of chestnuts. The edible portion of nut kernels is, with the major exception of chestnuts, very rich in fat content at between 50 percent and 65 percent. Protein content makes up 15-20 percent and carbohydrate content is between 10 percent and 15 percent. Starch and saccharose are the main components of dry chestnuts, accounting for about 75 percent. FAO covers ten primary nut crops. Each is listed below along with its code, its botanical name, or names, and a short description. NUT PRODUCTS include shelled nuts, whole or split, and further processed products, including roasted nuts, meal/flour, paste, oil, etc. Nut oils are not separately identified in the FAO classification; instead they are included under the heading ""oil of vegetable origin nes"". The most commonly marketed oils are almon oil and cashew nut oil and its derivative cardol.",,,,
97,Triticale,"A minor cereal that is a cross between wheat and rye, combining the quality and yield of wheat with the hardiness of rye.",,100890,100860,1191
275,Tung nuts,Aleurites cordata; A. fordii. Valued mainly for their oil.,,120799,120799,1499.02
692,Vanilla,"Vanilla planifolia; V. pompona. The fruit (or bean) of a climbing plant of the orchid family. Includes whole, crushed or ground.",,90500,"090510, 090520",1658
