Item Code,Item,Description,HS Code,HS07 Code,HS12 Code,CPC Code
800,Agave fibres nes,"Including inter alia: Haiti hemp (Agave foetida); henequen (A. fourcroydes); ixtle, tampico (A. lecheguilla); maguey (A. cantala); pita (A. americana); Salvador hemp (A. letonae). See 789. The leaves of some agave varieties are used for the production of alcoholic beverages, such as aquamiel, mezcal, pulque and tequila.",,530500,530500,1929.06
221,"Almonds, with shell","Prunus amygdalus; P. communis; Amygdalus communis. Produced mainly in Mediterranean countries, the United States and Asia.",,80211,80211,1371
711,"Anise, badian, fennel, coriander","Include: anise (Pimpinella anisum); badian or star anise (Illicium verum); caraway (Carum carvi); coriander (Coriandrum sativum); cumin (Cuminum cyminum); fennel (Foeniculum vulgare); juniper berries (Juniperus communis). Seeds and berries from the various plants listed. They are normally used as spices, but also have industrial (e.g. in distilleries) and medicinal applications.",,"090910, 090920, 090930, 090940, 090950","090921, 090922, 090931, 090932, 090961, 090962",1654
515,Apples,Malus pumila; M. sylvestris; M. communis; Pyrus malus.,,80810,80810,1341
526,Apricots,Prunus armeniaca.,,80910,80910,1343
226,Areca nuts,"Areca, betel nut (Areca catechu). Produced mainly in the Far East. Areca nuts are used mainly as masticatory. These nuts contain alkaloids (arecoline and arecaidine).",,80290,80280,1379.01
366,Artichokes,Cynara scolymus.,,70990,70991,1216
367,Asparagus,Asparagus officinalis.,,70920,70920,1211
572,Avocados,Persea americana.,,80440,80440,1311
203,Bambara beans,"Bambara groundnut, earth pea (Voandzeia subterranea). These beand are grown underground in a similar way to groundnuts.",,71339,71334,1708
486,Bananas,Musa sapientum; M. cavendishii; M. nana. Bananas are normally eaten raw. Trade figures may include dried bananas. Data should be reported excluding the weight of the central stalk.,,80300,80390,1312
44,Barley,"Hordeum spp.: two-row barley (H. disticum) six-row barley (H. hexasticum) four-row barley (H. vulgare). Tolerates poorer soils and lower temperatures better than does wheat. Varieties include with husk and without (naked). Used as a livestock feed, for malt and for preparing foods. The roasted grains are a coffee substitute.",,100300,"100310, 100390",115
782,"Bastfibres, other","Including inter alia: China jute (Abutilon avicennae); Congo jute, malva, paka (Urena lobata; U. sinuata); Indian flax (Abroma augusta); kenaf, meshta (Hibiscus cannabinus); rosella hemp (H. sabdariffa); sunn hemp (Crotalaria juncea). This definition covers all textile fibres extracted from the stems of dicotyledonous plants, o/t flax, ramie, true hemp and true jute. For trade coverage see 780.",,"530310, 530390","530310, 530390",1922.02
176,"Beans, dry","Phaseolus spp.: kidney, haricot bean (Ph. vulgaris); lima, butter bean (Ph. lunatus); adzuki bean (Ph. angularis); mungo bean, golden, green gram (Ph. aureus); black gram, urd (Ph. mungo); scarlet runner bean (Ph. coccineus); rice bean (Ph. calcaratus); moth bean (Ph. aconitifolius); tepary bean (Ph. acutifolius). Only species of Phaseolus should be included, though several countries also include certain types of beans. Commonly classified as Vigna (angularis, mungo, radiata, aconitifolia). In the past, these species were also classified as Phaseolus.",,"071331, 071332, 071333, 071339","071331, 071332, 071333, 071339",1701
414,"Beans, green",Phaseolus and Vigna spp.. For shelling.,,70820,70820,1241.9
558,Berries nes,"Including inter alia: blackberry (Morus nigra); loganberry; white, red mulberry (M. alba; M. rubra); myrtle berry (Myrtus communis) huckleberry, dangleberry (Gaylussacia spp.). Other berries not separately identified. In some countries, some or all of the berries listed previously are reported under this general category.",,"081020, 081040","081020, 081040",1355.9
552,Blueberries,"European blueberry, wild bilberry, whortleberry (Vaccinium myrtillus); American blueberry (V. corymbosum). Trade data may include cranberries, myrtle berries and other fruits of the genus Vaccinium.",,81040,81040,1355.01
216,"Brazil nuts, with shell","Brazil, Para or cream nut (Bertholletia excelsa).",,80121,80121,1377
181,"Broad beans, horse beans, dry",Vicia faba: horse-bean (var. equina); broad bean (var. major); field bean (var. minor).,,71350,71350,1702
89,Buckwheat,"Fagopyrum esculentum (Polygonaceae). A minor cereal cultivated primarily in northern regions. Buckwheat is considered a cereal, although it does not belong to the gramineous family.",,100810,100810,1192
358,Cabbages and other brassicas,"Chinese, mustard cabbage, pak-choi (Brassica chinensis); white, red, savoy cabbage, Brussels sprouts, collards, kale and kohlrabi (Brassica oleracea all var. except botrytis).",,"070420, 070490","070420, 070490",1212
101,Canary seed,Phalaris canariensis. Minor cereal normally used as bird feed.,,100830,100830,1195
461,Carobs,"Ceratonia siliqua Carob-tree, locust bean. Includes also seeds. Mainly used as an animal feed and for industrial purposes. Rich in pectin.",,121299,121292,1356
426,Carrots and turnips,Daucus carota. Trade data may include turnips (Brassica rapa var. rapifera).,,70610,70610,1251
217,"Cashew nuts, with shell","Anacardium occidentale. Produced mainly in East Africa, India and Brazil.",,80131,80131,1372
591,Cashewapple,"Anacardium occidentale. The thickened, fleshy stem below the cashew nut. When soft it is used for jam.",,81090,81090,1359.02
125,Cassava,"Manioc, mandioca, yuca (Manihot esculenta, syn. M. utilissima); yuca dulce (M. palmata, syn. M. dulcis). A semi-permanent crop grown in tropical and subtropical regions. Sometimes bitter and sweet cassavas are referred to as separate species, the former being M. esculenta and the latter M. palmata, but this is incorrect since the toxicity varies according to location. Cassava is the staple food in many tropical countries. It is not traded internationally in its fresh state because tubers deteriorate very rapidly.",,71410,71410,1520.01
378,Cassava leaves,Manihot esculenta; M. utilissima. Young cassava leaves are eaten in some areas of Africa as a vegetable.,,70990,70999,1219.01
265,Castor oil seed,"Ricinus communis. Valued mainly for their oil, which is used in pharmaceutical products. Ground seedcakes are used as fertilizers (castor oil pomace).",,120799,120730,1447
393,Cauliflowers and broccoli,"Brassica oleracea var. botrytis, subvariety cauliflora and cymosa. Includes headed broccoli.",,70410,70410,1213
108,Cereals nes,"Including inter alia: canagua or coaihua (Chenopodium pallidicaule); quihuicha or Inca wheat (Amaranthus caudatus); adlay or Job's tears (Coix lacryma-jobi); wild rice (Zizania aquatica). Other cereal crops that are not identified separately because of their minor relevance at the international level. Because of their limited local importance, some countries report cereals under this commodity heading that are classified individually by FAO.",,100890,100890,1199.9
1717,"Cereals, Total","Cereals are generally of the gramineous family and, in the FAO concept, refer to crops harvested for dry grain only. Crops harvested green for forage, silage or grazingare classified as fodder crops. Also excluded are industrial crops, e.g. broom sorghum (Crude organic materials nes) and sweet sorghum when grown for syrup (Sugar crops nes). For international trade classifications, fresh cereals (other than sweet corn), whether or not suitable for use as fresh vegetables, are classified as cereals. Cereals are identified according to their genus. However, when two or more genera are sown and harvested as a mixture they should be classified and reported as ""mixed grains"". Production data are reported in terms of clean, dry weight of grains (12-14 percent moisture) in the form usually marketed. Rice, however, is reported in terms of paddy. Apart from moisture content and inedible substances such as cellulose, cereal grains contain, along with traces of minerals and vitamins, carbohydrates - mainly starches - (comprising 65-75 percent of their total weight), as well as proteins (6-12 percent) and fat (1-5 percent). The FAO definitions cover 17 primary cereals, of which one - white maize - is a component of maize. Each definition is listed along with its code, botanical name or names, and a short description. Cereal products derive either from the processing of grain through one or more mechanical or chemical operations, or from the processing of flour, meal or starch. Each cereal product is listed after the cereal from which it is derived.",,,,
531,Cherries,"Mazzard, sweet cherry (Prunus avium; Cerasus avium); hard-fleshed cherry (var. duracina); heart cherry (var. juliana).",,80920,80929,1344.02
530,"Cherries, sour",Prunus cerasus; Cerasus acida.,,80920,80921,1344.01
220,Chestnut,Castanea spp.: C. vesca; C. vulgaris; C. sativa. Produced mainly in Europe and Asia.,,80240,"080241, 080242",1373
191,Chick peas,"Chickpea, Bengal gram, garbanzos (Cicer arietinum).",,71320,71320,1703
459,Chicory roots,Horium intybus; C. sativum. Unroasted chicory roots.,,121299,121294,1691
689,"Chillies and peppers, dry","Red and cayenne pepper, paprika, chillies (Capsicum frutescens; C. annuum); allspice, Jamaica pepper (Pimenta officinalis). Uncrushed or unground fresh pimentos are considered to be vegetables.",,90420,"090421, 090422",1652
401,"Chillies and peppers, green","Capsicum annuum; C. fructescens; Pimenta officinalis. Production data exclude crops cultivated explicitly as spices. In contrast, trade data include these crops, provided they are fresh, uncrushed and unground.",,70960,70960,1231
693,Cinnamon (cannella),"Ceylon cinnamon (Cinnamomum zeylanicum); Chinese, common cinnamon, cassia (C. cassia). The inner bark of young branches of certain trees of the Laurus family. Includes cinnamon- tree flowers, cinnamon fruit and cinnamon waste (chips), whether whole, crushed or ground.",,"090611, 090619, 090620","090611, 090619, 090620",1655
1804,"Citrus Fruit, Total",,,,,
698,Cloves,"Eugenia caryophyllata; Caryophyllus aromaticus. The whole fruit of the clove tree, including the flowers picked before maturity and dried in the sun, and the stems of the clove flowers.",,90700,"090710, 090720",1656
661,"Cocoa, beans","Theobroma cacao. The seeds contained in the fruit of the cacao- tree, including whole or broken, raw or roasted.",,180100,180100,1640
249,Coconuts,"Cocos nucifera Husked coconut. In shell, covered by the endocarp, while exocarp (the smooth outer skin) and mesocarp (the fibrous covering) are removed. Immature nuts contain a milky juice that is consumed as a refreshing drink. Mature nuts are consumed as such, or processed for copra or desiccated coconut. The flesh, from which copra/oil is extracted, constitutes 40-70% of the weight of the husked coconut. The oil content is about 36% of the flesh.",,80119,"080112, 080119",1460
656,"Coffee, green","Coffea spp. (arabica, robusta, liberica). Raw coffee in all forms.",,90111,90111,1610
813,Coir,Cocos nucifera. Coir fibre is obtained from the fibrous covering of the mesocarp. For trade coverage see 789.,,530500,530500,1929.08
195,"Cow peas, dry","Cowpea, blackeye pea/bean (Vigna sinensis; Dolichos sinensis).",,71339,71335,1706
554,Cranberries,"American cranberry (Vaccinium macrocarpon); European cranberry (V. oxycoccus). Trade data may include blueberries, myrtle berries and other fruits of the genus Vaccinium.",,81040,81040,1355.02
397,Cucumbers and gherkins,Cucumis sativus.,,70700,70700,1232
550,Currants,Black (Ribes nigrum); red and white (R. rubrum). Trade data may sometimes include gooseberries.,,81090,81030,1351.01
577,Dates,Phoenix dactylifera. Includes fresh and dried fruit.,,80410,80410,1314
399,Eggplants (aubergines),Solanum melongena. Also called aubergines.,,70930,70930,1233
821,Fibre crops nes,"Including inter alia: alfa, esparto (Lygeum spartum; Stipa tenacissima); bowstring hemp (Sansevieria spp.); caroa (Neoglaziovia variegata); fuque fibre (Furcraea macrophylla); Mauritius hemp (F. gigantea); New Zealand flax (Phormium tenax); palma ixtle (Samuela carnerosana). Other fibres that are not identified separately because of their minor relevance at the international level. Because of their limited local importance, some countries report vegetable fibres under this commodity heading that are classified individually by FAO. The fibre is obtained from the leaves, stalks or fruit of the plant. In instances where the fibrous part is normally used for other purposes, data cover only those fibres intended for spinning. For trade coverage see 789.",,530500,530500,1929.9
1753,Fibre Crops Primary,"Vegetal Fibres obtained from annual and perennial plants are used to produce thread and yarn that are manufactured into fabrics. These manufactured products are not classified as agricultural, and therefore are not included in the FAO definitions. Among vegetal fibres, FAO includes 12 primary crops and five derived agricultural products. The code and name of each of these crops is listed below, along with its botanical name, or names, and a short description where necessary. Certain fibre crops yield seeds used for sowing and for processing into oil and cake, and these are listed with oil-bearing crops and derived products.",,,,
569,Figs,Ficus carica.,,80420,80420,1315
773,Flax fibre and tow,"Broken, scutched, hackled etc. but not spun. Traditionally, FAO has used this commodity to identify production in its raw state; in reality, the primary agricultural product is the commodity 771, which can either be used for the production of fibre or for other purposes.",,"530121, 530129","530121, 530129",26190.01
94,Fonio,Digitaria spp.: fonio or findi (D. exilis); black fonio or hungry rice (D. iburua). A minor cereal of importance only in West Africa where it is eaten in place of rice during famines. The seeds are cooked by steaming the whole grain.,,100890,100840,1193
1738,Fruit Primary,"Fruit Crops consist of fruits and berries that, with few exceptions, are characterized by their sweet taste. Nearly all are permanent crops, mainly from trees, bushes and shrubs, as well as vines and palms. Fruits and berries grow on branches, stalks or the trunks of plants, usually singly, but sometimes grouped in bunches or clusters (e.g. bananas and grapes). Commercial crops are cultivated in plantations, but significant quantities of fruits are also collected from scattered plants that may or may not be cultivated. Although melons and watermelons are generally considered to be fruits, FAO groups them with vegetables because they are temporary crops. Fruit crops are highly perishable. Their shelf life may be extended through the application of chemical substances that inhibit the growth of micro-organisms and through careful control of the surrounding temperature, pressure and humidity once the fruit has been picked. Fruits and berries have a very high water content accounting for some 70- 90 percent of their weight. They contain, in various degrees, minerals, vitamins and organic acids, some of which reside in the peel or skin. Some fruits have a high fibre content and other inedible components, so that wastage is high, e.g. 60 percent for passion fruit and 35-45 percent for pineapples. The waste in temperate zone fruit is lower, generally of the order of 10-15 percent, while berries contain very little waste. The carbohydrate content of fruits varies widely. Protein content is very low, averaging less than 1 percent, or below that in vegetables. Fat content in fruit is negligible, with the notable exception of avocados. Fruit crops are consumed directly as food and are processed into dried fruit, fruit juice, canned fruit, frozen fruit, jam, alcoholic beverages, etc. Fruit crops are not normally grown for animal feed, although significant quantities of diseased and substandard fruits, as well as certain by-products of the fruit processing industry, are fed to animals. Production data for fruit crops should relate to fruits actually harvested. Data on bananas and plantains should relate to the weight of single bananas or banana hands, excluding the weight of the central stalk. FAO lists 36 primary fruit crops.",,,,
512,"Fruit, citrus nes",Including inter alia: bergamot (Citrus bergamia); citron (C. medica var. cedrata); chinotto (C. myrtifolia); kumquat (Fortunella japonica). Some minor varieties of citrus are used primarily in the preparation of perfumes and soft drinks.,,80590,80590,1329
619,"Fruit, fresh nes","Including inter alia: azarole (Crataegus azarolus); babaco (Carica pentagona); elderberry (Sambucus nigra); jujube (Zizyphus jujuba); litchi (nephelium litchi); loquat (Eriobotrya japonica); medlar (Mespilus germanica); pawpaw (Asimina triloba); pomegranate (Punica granatum); prickly pear (Opuntia ficus-indica); rose hips (Rosa spp.); rowanberry (Sorbus aucuparia); service-apple (Sorbus domestica); tamarind (Tamarindus indica); tree-strawberry (Arbutus unedo). Other fresh fruit that are not identified separately because of their minor relevance at the international level. Because of their limited local importance, some countries report fresh fruit under this heading that are classified separately by FAO.",,81090,81090,1359.9
542,"Fruit, pome nes","Other pome fruit not separately identified. In some countries apples, pears and quinces are reported under this general category.",,81090,81090,1349.1
541,"Fruit, stone nes","Other stone fruit not separately identified. In some countries, apricots, cherries, peaches, nectarines and plums are reported under this general category.",,81090,81090,1349.2
603,"Fruit, tropical fresh nes","Including inter alia: breadfruit (Artocarpus incisa); carambola (Averrhoa carambola); cherimoya, custard apple (Annona spp.); durian (Durio zibethinus); feijoa (Feijoa sellowiana); guava (Psidium guajava); hog plum, mombin (Spondias spp.); jackfruit (Artocarpus integrifolia); longan (nephelium longan); mammee (Mammea americana); mangosteen (Garcinia mangostana); naranjillo (Solanum quitoense); passion fruit (Passiflora edulis); rambutan (nephelium lappaceum); sapote, mamey colorado (Calocarpum mammosum); sapodilla (Achras sapota); star apple, cainito (Chrysophyllum spp.). Other tropical fresh fruit that are not identified separately because of their minor relevance at the international level. In some countries mangoes, avocados, pineapples, dates and papayas are reported under this general category.",,"080450, 081060, 081090","080450, 081060, 081090",1319
406,Garlic,Allium sativum.,,70320,70320,1252
720,Ginger,"Zingiber officinale. Rhizome of a perennial herb. It also is used for making beverages. Includes fresh, provisionally preserved or dried, whereas ginger preserved in sugar or syrup is excluded.",,91010,"091011, 091012",1657
549,Gooseberries,"Ribes grossularia. Trade data may sometimes include black, white or red currants.",,81090,81030,1351.02
103,"Grain, mixed","A mixture of cereal species that are sown and harvested together. The mixture wheat/rye is known as meslin, but in trade is usually classified with wheat.",,100890,100890,1199.02
507,Grapefruit (inc. pomelos),Citrus maxima; C. grandis; C. paradisi.,,80540,80540,1321
560,Grapes,Vitis vinifera. Includes both table and wine grapes.,,80610,80610,1330
242,"Groundnuts, with shell","Arachis hypogaea. For trade data, groundnuts in shell are converted at 70% and reported on a shelled basis.",,"120210, 120220","120230, 120241",142
839,"Gums, natural","Including inter alia: balata (Manilkara bidentata); ceara (Manihot glaziovii); chicle gum (Achras zapota); guayule (Parthenium argentatum); gutta-percha (Palachium gutta); jelutong (Dieva costulana). Extracted from the latex of trees of various species. Although similar to rubber in many ways, natural gums are usually less elastic.",,400130,400130,3211
225,"Hazelnuts, with shell",Corylus avellana. Produced mainly in Mediterranean countries and the United States.,,80221,80221,1374
777,Hemp tow waste,"Cannabis sativa. This plant is cultivated for seed as well as for fibre. The fibre is obtained from the stem of the plant. Trade data include raw, retted, scutched, combed fibre, tow and waste.",,"530210, 530290","530210, 530290",1929.02
336,Hempseed,Cannabis sativa. An annual herbaceous that is cultivated for its fibre as well as its oil. In major producing countries oil is extracted from the seeds.,,120799,120799,1449.02
677,Hops,"Humulus lupulus. Hop cones, fresh or dried, whether or not ground, powdered or in the form of pellets. Includes lupuline, a yellow resinous powder that covers the hop cones. Mainly used in the brewing industry to give flavour to beer.",,"121010, 121020","121010, 121020",1659
277,Jojoba seed,Simmondsia californica (syn. S. chinensis). From the shrub or small tree of the Buxaceae family.,,120799,120799,1499.03
780,Jute,"White jute (Corchorus capsularis); red jute, tossa (C. olitorius). Trade data cover raw or processed jute (but not spun), tow and waste, yarn waste and garnetted stock and may include jute-like fibres.",,"530310, 530390","530310, 530390",1922.01
310,Kapok fruit,"Ceiba pentandra, Bombacaceae. The fruit of kapok contains fibre and seeds, which FAO treats as primary crops.",,120799,120799,1499.05
263,Karite nuts (sheanuts),Butyrospermum parkii. Production data refer only to the nut contained in the fruit although the pulp around the nut is also edible.,,120799,120799,1499.01
592,Kiwi fruit,Actinidia chinensis.,,81050,81050,1352
224,Kola nuts,"Kola, cola, Sudan cola nut (Cola nitida; C. vera; C. acuminata). Produced mainly in Africa. Kola nuts, containing 2.4 to 2.6% caffeine, are commonly chewed by the local population. Much used in Europe and America in the production of beverages.",,80290,80270,1379.02
407,"Leeks, other alliaceous vegetables","Leeks (Allium porrum); chives (A. schoenoprasum); other alliac. (Allium varieties except those of 402, 403 and 406).",,70390,70390,1254
497,Lemons and limes,Lemon (Citrus limon); sour lime (C. aurantifolia); sweet lime (C. limetta).,,80550,80550,1322
201,Lentils,Lens esculenta; Ervum lens.,,71340,71340,1704
372,Lettuce and chicory,Lactuca sativa; witloof chicory (Cichorium intybus var. foliosum); endive (C. endivia var. crispa); escarole chicory (C. endivia var. latifolia).,,"070511, 070519, 070521, 070529","070511, 070519, 070521, 070529",1214
333,Linseed,Linum usitatissimum Flaxseed. An annual herbaceous that is cultivated for its fibre as well as its oil.,,120400,120400,1441
210,Lupins,"Lupinus spp.. Used primarily for feed, though in some parts of Africa and in Latin America some varieties are cultivated for human food.",,121490,121490,1709.02
56,Maize,"Zea mays Corn, Indian corn, mealies. A grain with a high germ content. At the national level, hybrid and ordinary maize should be reported separately owing to widely different yields and uses. Used largely for animal feed and commercial starch production.",,"100510, 100590","100510, 100590",112
446,"Maize, green","Zea mays, particularly var. saccharata. Maize harvested green for food. Saccharata variety is commonly known as sweet corn.",,70990,70999,1290.01
571,"Mangoes, mangosteens, guavas","Mangifera indica. Trade figures may include dried mangoes, guavas and mangosteens, including both fresh and dried.",,80450,80450,1316
809,Manila fibre (abaca),Musa textilis. The fibre is obtained from stalks of certain banana trees. For trade coverage see 789.,,530500,530500,1929.07
671,Maté,Ilex paraguayensis. The dried leaves of certain shrubs of the holly family which grow in South America. Prepared in a way similar to tea.,,90300,90300,1630
568,"Melons, other (inc.cantaloupes)",Cucumis melo;.,,80719,80719,1229
299,Melonseed,Cucumis melo. Includes seeds of other Cucurbitaceae.,,120799,120770,1449.01
79,Millet,"Including inter alia: barnyard or Japanese millet (Echinocloa frumentacea); ragi, finger or African millet (Eleusine coracana); teff (Eragrostis abyssinica); common, golden or proso millet (Panicum miliaceum); koda or ditch millet (Paspalum scrobiculatum); pearl or cattail millet (Pennisetum glaucum); foxtail millet (Setaria italica). Small-grained cereals that include a large number of different botanical species. Originated by the domestication of wild African grasses in the Nile valley and the Sahel zone, millets were subsequently taken to China and India. These cereals tolerate arid conditions and possess a small, highly nutritious grain that stores well. Used locally, both as a food and as a livestock feed. In all areas where they are cultivated, millets are used in traditional beer brewing. Also used as a feed for birds.",,100820,"100821, 100829",118
449,Mushrooms and truffles,Including inter alia: Boletus edulis; Agaricus campestris; Morchella spp. and Tuber magnatum. Cultivated or spontaneous. Includes truffles.,,"070951, 070959","070951, 070959",1270
292,Mustard seed,"White mustard (Brassica alba; B. hirta; Sinapis alba); black mustard (Brassica nigra; Sinapis nigra). In addition to the oil extracted from them, white mustard seeds, may be processed into flour for food use. Black mustard seeds also yield oil and are processed into flour that is used mainly in pharmaceutical products.",,120750,120750,1442
702,"Nutmeg, mace and cardamoms","Nutmeg, mace (Myristica fragrans); cluster cardamon (Elettaria cardamomum); other cardamons (Aframomum angustifolium; A. hambury; Amomun aromaticum; A. cardamomum); Malaguetta pepper, grains of paradise (Aframomum melegueta). Nutmeg is the inner brown kernel of the fruit of the nutmeg tree. Mace is the net-like membrane between the outer shell and the kernel. Cardamon seeds are enclosed in the capsule produced by perennial herbs of the Zingiberaceae family.",,"090810, 090820, 090830","090811, 090812, 090821, 090822, 090831, 090832",1653
